ID-Lattes	Título	Ano	DOI	Veículo	ISBN	Volume	Fascículo	Serie	P-inicial	P-final	Palavras-chave	
2142163449017349	Rotinas e Orientações para Autoconstrução: Em Busca da Sustentabilidade Social	2004		1º Conferência Latino-Americana de construção sustentável e 10º Encontro Brasileiro de Tecnologia do Ambiente Construído	8589478084				1	11	[]
2142163449017349	Avaliação de Projeto Padrão de Creche em Conjuntos Habitacionais de Interesse Social: O Aspecto da Implantação	2002		NUTAU 2002					242	252	[]
2142163449017349	O Processo Criativo: Relacionando a Teoria á Prática no Ensino do Projeto Arquitetônico	2000		1º Seminário International de Ensino de Projeto do ambiente Construído - SIEPAC							[]
2142163449017349	Automated Design Assistance for Self-Help Housing in Campinas, Brazil	2000		16º Bi-Annual Conference of the International Association for People - Environment Studies (IAPS)					1	6	[]
2142163449017349	Avaliação de Comportamento Infantil em Pátio Coberto em Creche de Conjunto Habitacional de Interesse Social: O Caso de Projeto Padrão	2000		ENTAC 2000					1	8	[]
2142163449017349	How to add Value to Social Housing in Brazil	2008		Ireland Planning Research Conference							[]
2142163449017349	O programa de necessidades e a importância de APO no processo de projeto	2008		XII Encontro Nacional de Tecnologia do Ambiente Construído 2008	9788589478274				1	12	[]
2142163449017349	Comparação entre a configuração das janelas em resposta a luz natural em salas de aula	2008		XII Encontro Nacional de Tecnologia do Ambiente Construido - ENTAC 2008	9788589478274						[]
2142163449017349	Environmental comfort and energy use in public school buildings: case study in Campinas, Brazil	2008		5th Windsor Conference							[]
2142163449017349	Avaliação de Desempenho do Ambiente Construído - APO -Prédio da Pós - Graduação da Faculdade de Economia da Unicamp - Campinas, SP	2008		7º Seminário Internacional - Espaço Sustentável Inovações em Edifícios e Cidades - NUTAU 2008							[]
2142163449017349	A prática da síntese da forma através da decomposição de requisitos	2009		IV PROJETAR 2009 - Projeto como investigação: ensino, pesquisa e prática		1			1	3	['metodologia de projeto', 'Processo de projeto arquitetônico', 'programa arquitetônico', 'programa de necessidades', 'Projeto Arquitetônico']
2142163449017349	Role playing is not enough: improved education for design professionals in relation to people with disabilities	2009		TG59 People in Construction Conference		1			1	12	[]
2142163449017349	Home Based Enterprises and the garment industry in São Paulo´s down town	2009		2009 ADGD Conference: The Multiple Faces of Identity in the Designed Environment		1			1	1	[]
2142163449017349	Desafios e realidades: O processo de projeto escolar no estado de São Paulo	2009		ENCAC 2009 X Encontro Nacional e VI Encontro Latino-Americano sobre Conforto no Ambiente Construído		1			1	3	['ambiente escolar', 'Avaliação de Projeto Arquitetônico', 'Avaliação Pós Ocupação APO', 'Funcionalidade', 'metodologia de projeto', 'prédios escolares']
2142163449017349	Os conceitos de satisfação e valor desejado na avaliação pós-ocupação em Habitação Social	2009		ENCAC 2009 X Encontro Nacional e VI Encontro Latino-Americano sobre Conforto no Ambiente Construído		1			1	3	[]
2142163449017349	Orientação e inclusão espacial às pessoas com deficiências visuais: diretrizes para projeto e execução de uma rota acessível e de um mapa tátil para o campus da UNICAMP	2009		ENCAC 2009 X Encontro Nacional e VI Encontro Latino-Americano sobre Conforto no Ambiente Construído		1			1	3	[]
2142163449017349	Analysis of the Building Process and of Energy Efficiency of Public Schools in the State of São Paulo, Brazil	2009		The sixth International Conference of the Center for the Study of Architecture in the Arab Region: Sustainable Architecture and Urban Development		1			1	3	['ambiente escolar', 'Conforto Ambiental', 'Estratégias de sustentabilidade', 'metodologia de projeto', 'prédios escolares', 'Projeto Arquitetônico']
2142163449017349	The not so passive Architecture: Getting people involved in their own environment	2009		The sixth International Conference of the Center for the Study of Architecture in the Arab Region: Sustainable Architecture and Urban Development		1			1	3	[]
2142163449017349	A aplicação do conceito do desenho universal no ensino de arquitetura: considerações sobre o uso de instrumentos de leitura de projeto	2009		ENCAC 2009 X Encontro Nacional e VI Encontro Latino-Americano sobre Conforto no Ambiente Construído		1			1456	1465	['Desenho Universal', 'Ensino de Projeto Arquitetônico', 'metodologia de projeto', 'Orientação espacial', 'psicologia ambiental', 'tactile maps (mapas táteis)']
2142163449017349	People and Urban Greening: Pioneers, Collaborators, Onlookers and The Absent	2009		City Futures 09 - International Conference on Globalism and Urban Change		1			1	3	[]
2142163449017349	Green Requalification: Getting people involved in their own environment	2009		IAPS - CSBE; Culture and Space in the Built Environment, Network		1			1	3	[]
2142163449017349	Education challenges for sustainable design and construction	2010		CIB World Building Congress							[]
2142163449017349	Rainwater retention capacity of green roofs in Campinas - Brazil	2010		3rd PALENC Conference jointly organized with 5th EPIC and 1 st Cool Roofs Conference - Palenc 2010							[]
2142163449017349	IMPROVING SCHOOL BUILDING QUALITY IN THE STATE OF SÃO PAULO, BRAZIL	2011		PLEA  2011  -­  27th International Conference on Passive and Low energy Architecture	9782874632778	2			169	174	['ambiente escolar', 'Arquitetura Bioclimática', 'Processo de projeto arquitetônico', 'Sustentabilidade']
2142163449017349	Os elementos de conforto o processo de projeto escolar no estado de São Paulo	2011		XI ENCAC 2011 - Encontro Nacional de Conforto no Ambiente Construído e VII ELACAC Encontro Latino Americano de Conforto no Ambiente Construído	21756333				1	10	['ambiente escolar', 'Arquitetura escolar', 'Conforto Ambiental', 'Processo de projeto arquitetônico']
2142163449017349	Análise de ferramentas de avaliação de projetos de edificações escolares	2011		XI ENCAC 2011, Encontro Nacional de Conforto no Ambiente Construído e VII ELACAC Encontro Latino Americano de Conforto no Ambiente Construído	21756333				1	10	['ambiente escolar', 'Arquitetura escolar', 'análise de desempenho', 'Avaliação de Projeto Arquitetônico', 'melhorias de projeto', 'Processo de projeto arquitetônico']
2142163449017349	Pesquisa experimental para avaliar a qualidade da água e a capacidade de retenção de água pluvial em coberturas verdes em Campinas Brasil	2010		Sustainable Building 2010 Brazil - SB10Brazil, 2010, São Paulo. Sustainable Building 2010 Brazil - SB10Brazil		1			68	75	['coberturas verdes']
2142163449017349	Ferramentas de avaliação de projetos ? aplicação em projetos de edificações escolares públicas do Estado de São Paulo	2011		SBQP 2011, 2. Simpósio Brasileiro de Qualidade do Projeto no Ambiente Construído	21764549				1	10	['ambiente escolar', 'Arquitetura escolar', 'Avaliação de Projeto Arquitetônico', 'Avaliação Pós Ocupação APO', 'Conforto Ambiental', 'melhorias de projeto']
2142163449017349	DESENHO UNIVERSAL E O DESENHO DO PROJETO: INCORPORANDO NECESSIDADES À CONCEITOS PROJETUAIS	2011		V PROJETAR ? 2011 - Processos de projeto: teorias e práticas					1	20	['Acessibilidade', 'Avaliação de sentidos', 'comportamento humano', 'comportamento humano e ambiente construído', 'Desenho Universal', 'Deficiente visual']
2142163449017349	O Desenho Universal no Processo de Projeto em Arquitetura	2011		ENEAC 2011 III Encontro Nacional de Ergonomia do Ambiente construído e IV Seminário Brasileiro de Acessibilidade Integral	21759707				1	12	['Acessibilidade', 'Desenho Universal', 'Processo de projeto arquitetônico']
2142163449017349	Caracterização do processo de projeto escolar público no Estado de São Paulo: potencialidades e desafios	2011		V PROJETAR ? 2011 - Processos de projeto: teorias e práticas					1	23	['ambiente escolar', 'Arquitetura escolar', 'Conforto Ambiental', 'Funcionalidade', 'metodologia de projeto', 'Processo de projeto arquitetônico']
2142163449017349	PROGRAMMING FOR BEHAVIOUR IN EDUCATIONAL ENVIRONMENTS	2012		22nd International Conference of the International Association of People Environment Studies IAPS 2012		?	1	1	?	?	['Arquitetura escolar', 'Avaliação Pós Ocupação APO', 'Banco de Dados', 'comportamento humano', 'comportamento humano e ambiente construído', 'processo de projeto em arquitetura e sua teoria']
2142163449017349	AN ARCHITECTURAL UNIVERSAL DESIGN CHARRETTE WITH PROFESSIONAL SENSITIVITY IN MIND	2012		22nd International Conference of the International Association of People Environment Studies IAPS 2012		?	1	1	?	?	['Acessibilidade', 'comportamento humano e ambiente construído', 'Desenho Universal', 'Processo de projeto arquitetônico', 'Projeto Arquitetônico', 'tactile maps (mapas táteis)']
2142163449017349	CAN DARWIN SHOW US THE WAY? Improving Social Housing through an evolutionary design approach	2013		CIB WBC 2013 World Building Congress 2013		1	1	1	1	12	['Valor desejado', 'satisfação do usuário', 'habitação social', 'qualidade da habitação']
2142163449017349	SUSTAINABLE SCHOOL BUILDINGS FOR SMART STUDENTS: IMPROVING SCHOOL BUILDING QUALITY IN THE STATE OF SÃO PAULO, BRAZIL	2012		International Conference 4th SASBE 2012 Smart and Sustainable Built Environment		?	1	1	?	?	['Arquitetura escolar', 'Sustentabilidade', 'Processo de projeto arquitetônico']
2142163449017349	GERENCIAMENTO DE VALOR EM EHIS: UMA PROPOSTA PARA REAVALIAÇÃO DE CUSTOS COM BASE NA ENTREGA DE VALOR AOS USUÁRIOS FINAIS	2012		ENTAC 2012 Encontro Nacional de Tecnologia no Ambiente Construído: Da concepção à desconstrução:a integração do ambiente construído		1		1	1	11	['habitação social', 'satisfação do usuário', 'Valor desejado']
2142163449017349	PROGRAMANDO A ARQUITETURA ESCOLAR	2013		XII ENCAC		1			1	10	['Arquitetura escolar', 'Processo de projeto arquitetônico']
2142163449017349	APOIANDO O PROJETO VERTICAL: PREMISSAS BÁSICAS	2013		XII ENCAC		1			1	10	['verticalidade', 'Processo de projeto arquitetônico']
2142163449017349	APLICAÇÃO DE MÉTODO DE ANÁLISE DE PRECEDENTES EM PROJETOS DE EDIFICAÇÕES ESCOLARES	2013		XII ENCAC		1			1	10	['Arquitetura escolar', 'Avaliação de Projeto Arquitetônico']
2142163449017349	METODOLOGIA DE PESQUISA EM ARQUITETURA E DESIGN: INSTRUMENTOS DE COLETA DE DADOS 3D DESTINADOS A ALUNOS CEGOS	2013		SBQP/TIC 2013 III Simpósio Brasileiro de Qualidade no Ambiente Construído e VI Encontro de Tecnologia de Informação e Comunicação na Construção		1			1	10	['Acessibilidade', 'Desenho Universal', 'orientabilidade', 'wayfinding']
2142163449017349	PROJETOS ARQUITETÔNICOS PARTICIPATIVOS VISANDO MUDANÇAS DE PRÁTICAS, ATENÇÃO E GESTÃO NO SUS	2013		SBQP/TIC 2013 III Simpósio Brasileiro de Qualidade no Ambiente Construído e VI Encontro de Tecnologia de Informação e Comunicação na Construção		1			1	10	['humanização', 'hospitais', 'processo participativo']
2142163449017349	AVALIAÇÃO DE PROJETO: A BUSCA POR UMA FERRAMENTA PARA AS QUESTÕES DO DESENHO UNIVERSAL	2013		SBQP/TIC 2013 III Simpósio Brasileiro de Qualidade no Ambiente Construído e VI Encontro de Tecnologia de Informação e Comunicação na Construção		1			1	10	['Desenho Universal', 'Avaliação de Projeto Arquitetônico']
2142163449017349	SUSTAINABLE SCHOOL BUILDINGS FOR SMART STUDENTS: IMPROVING SCHOOL BUILDING QUALITY IN THE STATE OF SÃO PAULO, BRAZIL	2013		SBQP/TIC 2013 III Simpósio Brasileiro de Qualidade no Ambiente Construído e VI Encontro de Tecnologia de Informação e Comunicação na Construção		1			1	10	['wayfinding', 'Arquitetura escolar', 'Deficiente visual']
2142163449017349	O instrumento de coleta de dados observação destinado a alunos cegos para implantação do wayfinding no edifício escolar.	2013		SBQP TIC III SIMPÓSIO BRASILEIRO DE QUALIDADE DO PROJETO NO AMBIENTE CONSTRUÍDO, VI ENCONTRO BRASILEIRO DE TECNOLOGIA DE INFORMAÇÃO E COMUNICAÇÃO NA CONSTRUÇÃO, 2013,		1	1	1	1	19	['Acessibilidade', 'Avaliação de Projeto Arquitetônico', 'Desenho Universal']
2142163449017349	Metodologia de pesquisa em arquitetura, design e programação visual de escolas: técnicas de coleta de dados que incluem crianças com deficiência intelectual	2013		SBQP TIC III SIMPÓSIO BRASILEIRO DE QUALIDADE DO PROJETO NO AMBIENTE CONSTRUÍDO, VI ENCONTRO BRASILEIRO DE TECNOLOGIA DE INFORMAÇÃO E COMUNICAÇÃO NA CONSTRUÇÃO, 2013		1	1	1	1	20	['Acessibilidade', 'Avaliação de Projeto Arquitetônico', 'Desenho Universal']
2142163449017349	Questões Éticas na Pesquisa em Avaliação Pós-Ocupação (APO)	2014		XV ENCONTRO NACIONAL DE TECNOLOGIA DO AMBIENTE CONTRUÍDO					1	9	['Avaliação Pós Ocupação APO', 'metodologia de projeto', 'Ética no processo de projeto']
2142163449017349	Avaliação Pós-Ocupação (APO) e o Wayfinding Design	2014		XV Encontro Nacional de Tecnologia do Ambiente Construído					1	10	['wayfinding', 'Avaliação Pós Ocupação APO', 'Acessibilidade']
2142163449017349	Programando a arquitetura escolar do futuro	2013		ELECS, Encontro Latinoamericano de Edificações e Comunidades Sustentáveis					1	10	['ambiente escolar', 'Arquitetura Vernacular', 'programa arquitetônico', 'psicologia ambiental', 'pedagogia']
2142163449017349	Pressupostos Teóricos da Deficiência Relacionados à Acessibilidade e ao Desenho Universal	2014		V Encontro Nacional de Ergonomia do Ambiente Construído, VI Seminário Brasileiro de Acessibilidade Integral	978-85-99959				1	12	['Desenho Universal', 'Deficiente visual']
2142163449017349	PROGRAMMING BETTER SCHOOL BUILDINGS USING A GAME BASED ON DESIGN PATTERNS	2015		ARCHDESIGN conference					1	13	['Arquitetura escolar', 'programa arquitetônico', 'Jogos']
2142163449017349	The Panorama of studies on the Brazilian housing program called ?Minha Casa Minha Vida?	2015		Asian Pacific Network for Housing Research Conference, APNHR 2015					1	8	['Banco de Dados', 'habitação social', 'Programa Minha Casa Minha Vida', 'PMCMV', 'Pesquisa sistemática bibliográfica']
2142163449017349	AS PESQUISAS SOBRE ?MINHA CASA MINHA VIDA? E O CONFORTO AMBIENTAL?	2015		XIV ENCAC ELACAC 2015 - XIII Encontro Nacional e IX Encontro Latino-americano de Conforto no Ambiente Construído		1	1		1	8	['Banco de Dados', 'habitação social', 'habitação', 'Pesquisa sistemática bibliográfica']
2142163449017349	PROGRAMANDO AMBIENTES DE APRENDIZAGEM PARA ESCOLAS BRASILEIRAS	2015		XIV ENCAC ELACAC 2015 - XIII Encontro Nacional e IX Encontro Latino-americano de Conforto no Ambiente Construído		1	1		1	8	['ambiente escolar', 'Arquitetura escolar', 'comportamento humano e ambiente construído', 'programa arquitetônico', 'psicologia ambiental']
2142163449017349	O JOGO DE CARTAS COMO INSTRUMENTO DE APOIO AO PROGRAMA ARQUITETÔNICO ESCOLAR	2015		XIV ENCAC ELACAC 2015 - XIII Encontro Nacional e IX Encontro Latino-americano de Conforto no Ambiente Construído		1	1		1	8	['ambiente escolar', 'Arquitetura escolar', 'Jogos', 'programa arquitetônico', 'Processo de projeto arquitetônico']
2142163449017349	Programando Espaços de Aprendizagem: uma Contribuição para a educação brasileira	2015		IV Simpósio Brasileiro de Qualidade do Projeto no Ambiente Construído SBQP 2015		1	1		1	8	['ambiente escolar', 'Arquitetura escolar']
2142163449017349	AS PESQUISAS SOBRE O PROCESSO DE PROJETO EM ARQUITETURA: ARGUMENTOS PARA REFLEXÃO	2015		7. PROJETAR 2015		1	1		1	10	['Banco de Dados', 'Processo de projeto arquitetônico', 'Pesquisa sistemática bibliográfica', 'Pesquisa em Projeto de Arquitetura']
2142163449017349	WHERE DO ARCHITECTURAL DESIGN IDEAS COME FROM? A SUSTAINABILITY AND BIOCLIMATIC-ORIENTED TEACHING EXPERIENCE	2016		SBE 16 - International Conference on Sustainable Built Environment	978-3-00-0522	1	1	1	1	12	['ambiente escolar', 'Ensino de Arquitetura e Urbanismo', 'metodologia de projeto', 'Processo Criativo', 'Processo de projeto arquitetônico']
2142163449017349	AS PESQUISAS SOBRE MINHA CASA MINHA VIDA	2016		II Congresso Internacional de Habitação Coletiva Sustentável		1	1	1	1	12	['Pesquisa sistemática bibliográfica', 'PMCMV', 'Minha Casa Minha Vida', 'habitação social']
2142163449017349	Participation and inclusion: innovative research methods and tools to assess schools for the visually impaired	2016		24th IAPS conference of the International association People-Environment Studies		1	1	1	35	36	['ambiente escolar', 'Avaliação Pós Ocupação APO', 'Desenho Urbano', 'metodologia de projeto', 'Acessibilidade']
2142163449017349	Improving school buildings and the agents of change	2016		24th IAPS conference of the International association People-Environment Studies		1	1	1	283	284	['ambiente escolar', 'Arquitetura escolar', 'Jogos', 'metodologia de projeto', 'programa arquitetônico', 'programa de necessidades']
2142163449017349	E agora? Uma metodologia para discutir o desenho universal em projetos padronizados	2016		VI Encontro Nacional de Ergonomia do Ambiente Construído & VII Seminário Brasileiro de Acessibilidade Integral.	2318-6968	2	7		1	18	['Acessibilidade', 'Desenho Universal', 'Projeto Padrão']
2142163449017349	O jogo da arquitetura: discutindo a acessibilidade para surdo	2016		VI Encontro Nacional de Ergonomia do Ambiente Construído & VII Seminário Brasileiro de Acessibilidade Integral	2318-6968	2	7		19	40	['Acessibilidade', 'Desenho Universal', 'surdos']
2142163449017349	Arquitetura escolar e projeto: paralelo entre experiências britânica e brasileira	2017		V SBQP - Simpósio Brasilieiro de Qualidade de Projeto no Ambiente Construído							['ambiente escolar', 'Arquitetura escolar', 'Escola do Século XXI']
2142163449017349	Métodos visuais, parâmetros de projeto e auxílio na criação do programa arquitetônico escolar	2017		PROJETAR 2017, VIII Seminário Internacional Projetar							['ambiente escolar', 'Arquitetura escolar', 'Parâmetros de Projeto', 'Visual Design Methods']
2142163449017349	Dinâmicas de Apoio ao Processo de Projeto Arquitetônico: a experiência com o Baralho da Escola no ambiente de ensino de projeto	2017		PROJETAR 2017, VIII Seminário Internacional Projetar							['ambiente escolar', 'Arquitetura escolar', 'Jogos', 'Processo de projeto arquitetônico']
2142163449017349	Importance of Learning Modalities in the comfort of School Architecture	2017		XIV ENCAC & X ELACAC							['ambiente escolar', 'Arquitetura escolar', 'Conforto Ambiental', 'Modalidades de Aprendizagem']
2142163449017349	Climate Responsiveness and Facade Design of AQUA-Certified School Buildings	2017		World Sustainable Built Environment Conference 2017							['Arquitetura escolar', 'desempenho', 'certificação', 'facade design']
2142163449017349	Evaluating circulation as space and movement in examples of contemporary architecture	2019		Ninth International Conference on the Constructed Environment		1			1	10	['análise de projeto arquitetônico', 'Architectural design process', 'circulação', 'Arquitetura contemporânea']
2142163449017349	A circulação em arquitetura: uma análise gráfica e sua contribuição ao processo de projeto	2019		XV Encontro Nacional de Conforto no Ambiente Construído e XI Encontro Latino-Americano de Conforto no Ambiente Construído					1	10	['análise de projeto arquitetônico', 'Architectural design process', 'circulação', 'Arquitetura contemporânea']
2142163449017349	Parâmetros de projeto escolar e avaliação arquitetônica de escolas públicas	2019		XV Encontro Nacional de Conforto no Ambiente Construído e XI Encontro Latino-Americano de Conforto no ambiente Construído					1	10	['ambiente escolar', 'análise de projeto arquitetônico', 'Parâmetros de Projeto', 'Escola Pública']
2142163449017349	O processo de projeto de arquitetura escolar no Estado de São Paulo: caracterização e possibilidades de intervenção	2010		1º Workshop GAE-PROLUGAR-SEL - O LUGAR DO PÁTIO ESCOLAR NO SISTEMA DE ESPAÇOS LIVRES							[]
2542913266521798	O dirigente sindical: companheiro ou patrão ? Uma análise em sindicatos de Minas Gerais	1999		Encontro Nacional da ANPAD							['Gestão Organizacional', 'Sindicato']
2542913266521798	Os desafios da gestão sindical em um contexto de reestruturação produtiva - uma análise da gestão administrativa na perspectiva dos dirigentes em sindicatos de Minas Gerais	1999		Encontro da ABET							[]
2542913266521798	A participação nos lucros e/ou resultados e a modernidade organizacional: uma análise em empresas de MInas Gerais	1999		Encontro da ABET							[]
2542913266521798	A construção do papel do gerente: flexibilidade ou indefinição ?	1995		BALAS (Busainess Association of Latin American Studies							['Flexibilização', 'Gerência']
2542913266521798	Negociação Coletiva na Categoria dos Bancários de Belo Horizonte - Os Anos Recentes	1989		13º Encontro Anual da Assoiciação Nacional dos Programas de Pós-Graduação em Administração		III			1811	1824	['Sindicato', 'Negociação']
2542913266521798	A Problemática dos Conflitos em Micro e Pequenas Unidades Produtivas	1991		Encontro Anual da ANPAD		7			259	268	['Pequenas Empresas', 'Paternalismo']
2542913266521798	A Aproximação de um Centro Tecnológico Estadual com o Setor Produtivo Privado - Notas Preliminares para Discussão	1992		Encontro Anual da Associação Nacional dos Programas de Pós-Graduação em Administração		1			25	36	['Gestão Tecnológica']
2542913266521798	Os Encontros Anuais da ANPAD - Levantamento sobre a Origem dos Trabalhos e Comunicações entre 1988 e 1991	1992		Encontro Anual da ANPAD		3			49	61	['Formação e Treinamento em Administração']
2542913266521798	Revisitando a Função Recursos Humanos: a visão estratégica representa modernização ?	1994		18º Encontro Anual da Associação Nacional de Programas de Pós-Graduação em Administração		10			72	84	['Gestão de Recursos Humanos', 'Estratégia Organizacional']
2542913266521798	Formação e Treinamento de Administração para Implantação de Programa de Qualidade nas Pequenas e Médias Empresas: Novas Mentalidades ou Práticas Tradicionais ?	1994		18º Encontro Anual da ANPAD							['Formação e Treinamento em Administração', 'Pequenas Empresas', 'Qualidade']
2542913266521798	A Formação do Administrador e a Formação Sindical: O Papel das Escolas de Administração	1995		19º Encontro Anual da ANPAD		1	3		63	76	['Sindicato', 'Formação e Treinamento em Administração']
2542913266521798	Sindicato e Política de Recursos Humanos: Olhando para si mesmo - um estudo junto a 20 sindicatos de Minas Gerais	1996		Encontro Anual da ANPAD		RH					['Gestão de Recursos Humanos', 'Sindicato']
2542913266521798	Impacto Tecnológico sobre a Gestão Sindical: Um Estudo em Minas Gerais	1996		XIX Simpósio de Gestão da Inovação Tecnológica		2			1639	1651	['Sindicato', 'Gestão Tecnológica']
2542913266521798	Modernização e Gestão de Recursos Humanos no Setor Público: O Caso da Urbel em Belo Horizonte	1997		VII Congresso Anual da Associação Nacional dos Programs de Graduação em Administração Angrad		1			19	32	['Gestão Pública']
2542913266521798	Relações de Trabalho e Gestão de Recursos Humanos - Um Estudo de Caso	1993		Encontro da Associação Nacional dos Programas de Pós-Graduação em Administração		10			92	102	['Gestão de Recursos Humanos', 'Relações de Trabalho']
2542913266521798	O real e o imaginário: o consuimidor enquanto cidadão	1993		Encontro Nacional da ANPAD		8			8	18	['Consumo', 'Cidadania']
2542913266521798	Discurso e Prática Gerencial na Esfera Municipal: Uma Experiência de Gestão Pública em Minas Gerais	1997		Encontro da Associaçãoi Nacional dos Programas de Pós-Graduação em Admnistração -_ ENANPAD							['Gestão Pública']
2542913266521798	Transformação Produtiva, Gestão Empresarial e Formação do Administrador: Notas sobre a Estrutura do Curso de Graduação em Administração	1995		VI ENANGRAD - Encontro Nacional da Associação Nacional dos Programas de Graduação em Administração		1			79	93	['Formação e Treinamento em Administração', 'Gestão Organizacional']
2542913266521798	Gestão de Competências em Organizações: Um Mosaico das Experiências em Minas Gerais	2001		Encontro Nacional da Associação Nacional dos Programas de Pós-Graduação em Administração							['Gestão de Competências']
2542913266521798	Participação nos Lucros e/ou Resultados: uma forma de remuneração variável ? Um Estudo no setor metalúrgico da Região Metropolitana de Belo Horizonte	2001		ENANPAD							['Participação nos Lucros e/ou Resultados', 'Remuneração']
2542913266521798	Uma Abordagem Organizacional na Segurança Pública: Notas para Discussão	2002		II Encontro de Estudos Organizacionais							['Gestão Pública']
2542913266521798	Competências nas Organizações: o Discurso e a Prática na Gestão de Pessoas	2002		XXVI Encontro Nacional da Associação Nacional dos Programas de Pós-Graduação em Administração							['Competências Organizacionais', 'Gestão de Recursos Humanos']
2542913266521798	Análise da Estrutura Organizativa e o Corpo Funcional frente às Transformações Produtivas: Um Perfil do Sindicalismo em Quatro Estados Brasileiros	2002		XXVI Encontro Anual da ANPOCS							['Sindicato', 'Formatos Organizacionais', 'Estrutura Organizacional']
2542913266521798	Modelos de Policiamento para a Gestão da Segurança Pública	2002		XXVI Encontro Nacional da Associação Nacional dos Programas de Pós-Graduação em Administração							['Gestão Organizacional']
