ID-Lattes	Título	Ano	DOI	Veículo	ISBN	Volume	Fascículo	Serie	P-inicial	P-final	Palavras-chave	
4727357182510680	Estimación de distancias absolutas utilizando un puntero láser y una cámara web	2009		III Simposio Peruano de Computación Gráfica y Procesamiento de Imágenes, SCGI							['computer vision']
4727357182510680	3D Linear Facial Animation Based on Real Data	2010	10.1109/SIBGRAPI.2010.44	Brazilian Symposium on Computer Graphics and Image Processing SIBGRAPI 2010	9781424484				271	278	[]
4727357182510680	Detección de huevos helmintos mediante plantillas dinámicas	2010	10.13140/RG.2.1.2852.3368	XXXVIth Latin American Informatics Conference (XXXVI CLEI)					1	12	[]
4727357182510680	A new approach to detect communities in multi-weighted co-authorship networks	2010	10.1109/SCCC.2010.31	XXIX International Conference of the Chilean Computer Science Society	9781457700				131	138	['co-authorship network', 'community structure detection', 'multi-weighted graph', 'Document engineering']
4727357182510680	3D Facial expression analysis by using 2D and 3D wavelet transforms	2011	10.1109/ICIP.2011.6115668	International Conference on Image Processing					1281	1284	['facial expressions analysis', 'wavelet transforms', '3D face']
4727357182510680	Visualização interativa de redes sociais: um estudo de caso em redes de colaboração científica	2011	10.13140/RG.2.1.1145.2004	Simposio Latinoamericano sobre Computación Gráfica, Realidad Virtual y Procesamiento de Imágenes					1	16	['social networks', 'interactive visualization', 'graphs']
4727357182510680	3D human face reconstruction using principal components spaces	2011	10.13140/RG.2.1.3963.2482	XXIV Sibgrapi ? Conference on Graphics, Patterns and Images					1	6	['3D human face', '3D face reconstruction', 'principal components analysis', 'computer graphics']
4727357182510680	3D facial animation based on structural registration	2011	10.13140/RG.2.1.5011.8246	XXIV Sibgrapi ? Conference on Graphics, Patterns and Images					1	6	['animation and games', 'modeling and reconstruction', 'computer graphics']
4727357182510680	Towards automatic discovery of co-authorship networks in the Brazilian academic areas	2011	10.1109/eScienceW.2011.31	Workshop On Measuring the Impact of e-Science Research (MeSR 2011) - In Conjunction with 7th IEEE International Conference on e-Science					53	60	['knowledge discovery', 'co-authorship network', 'academic areas']
4727357182510680	Caracterizando as redes de coautoria de currículos Lattes	2012	10.13140/RG.2.1.2849.1364	Brazilian Workshop on Social Network Analysis and Mining (BraSNAM)							['academic areas', 'co-authorship network', 'extraction and treatment of social data']
4727357182510680	Minerando e Caracterizando Dados de Currículos Lattes	2012	10.13140/RG.2.1.1007.8164	Brazilian Workshop on Social Network Analysis and Mining (BraSNAM)							['co-authorship network', 'data mining', 'Document engineering', 'Lattes platform', 'knowledge discovery']
4727357182510680	Dinâmica das Relações de Coautoria nos Programas de Pós-Graduação em Computação no Brasil	2012	10.13140/RG.2.1.3438.9604	Brazilian Workshop on Social Network Analysis and Mining (BraSNAM)							['extraction and treatment of social data', 'knowledge discovery', 'Lattes platform']
4727357182510680	Análise temporal da relação orientador-orientado: um estudo de caso sobre a produtividade dos pesquisadores doutores da área de Ciência da Computação	2012	10.13140/RG.2.1.3307.8880	Brazilian Workshop on Social Network Analysis and Mining (BraSNAM)							['computer science', 'academic production report', 'data mining']
4727357182510680	Perfil de Produção Bibliográfica dos Programas Brasileiros de Pós-Graduação em Ciência da Computação	2012	10.13140/RG.2.1.4946.2886	3º Encontro Brasileiro de Bibliometria e Cientometria - EBBC							['produção em ciência da computação', 'artigos publicados em anais', 'perfil de produção bibliográfica']
4727357182510680	Towards a quantitative academic internationalization assessment of Brazilian research groups	2012	10.1109/eScience.2012.6404456	2012 IEEE 8th International Conference on EScience (eScience)	9781467344661				1	8	['International Publication Ratio', 'Brazilian research groups', 'Lattes platform']
4727357182510680	Correlation among the scientific production, supervisions and participation in defense examination committees in the Brazilian physicists community	2013	10.13140/RG.2.1.3897.7120	14th International Society of Scientometrics and Informetrics Conference	2175-1935	I			447	474	[]
4727357182510680	Using Link Prediction to Estimate the Collaborative Influence of Researchers	2013	10.1109/eScience.2013.32	2013 IEEE 9th International Conference on eScience (eScience)	9780769550831				293	300	['link prediction', 'influential vertex', 'vertex centrality', 'networks']
4727357182510680	Caracterização de árvores de genealogia acadêmica por meio de métricas em grafos	2014	10.13140/RG.2.1.4159.8569	Brazilian Workshop on Social Network Analysis and Mining (BraSNAM)							['academic genealogy', 'Mathematicians', 'graph theory']
4727357182510680	Comunicação científica no Brasil (1998-2012): infraestrutura nacional e internacionalização	2014	10.13140/RG.2.1.3635.5681	XIII Congreso Internacional de Información INFO´2014							['Revistas científicas nacionais', 'Produtividade', 'Avaliação de pesquisa', 'Internacionalização']
4727357182510680	Caracterização do banco de teses e dissertações da CAPES	2014	10.13140/RG.2.1.2062.7046	4º Encontro Brasileiro de Bibliometria e Cientometria - EBBC							['teses e dissertações', 'banco de dados', 'caracterização', 'brasil']
4727357182510680	Análise da atualização dos currículos lattes: Uma análise macro sobre as datas das últimas atualizações dos currículos Lattes	2014	10.13140/RG.2.1.4290.9283	4º Encontro Brasileiro de Bibliometria e Cientometria - EBBC							['Bases de dados', 'Currículos Lattes']
4727357182510680	Índice-h genealógico expandido: Uma medida de impacto em grafos de orientação acadêmica	2015	10.13140/RG.2.1.3373.4241	Workshop on Social Network Analysis and Mining (BraSNAM 2015)					1	12	[]
4727357182510680	Scholarly Collaboration in Regional Science in Developing Countries: The Case of the Brazilian REAL Network	2015		XIII Encontro Nacional da Associação Brasileira de Estudos Regionais e Urbanos					1	29	[]
4727357182510680	A coautoria acadêmica interprogramas da pós-graduação em ciência da informação: Uma análise baseada em métricas em grafos	2015	10.13140/RG.2.1.3616.9688	XVI Encontro Nacional de Pesquisa em Pós-Graduação em Ciência da Informação							['bibliometria', 'programas de pós-graduação', 'coautoria', 'redes de coautoria', 'grafos']
4727357182510680	O QUALIS/CAPES como indicador qualitativo de comunicação da ciência: análise da produção acadêmica dos programas de pós-graduação em Ciência da Informação	2015		VII Encuentro Ibérico - EDICIC 2015	978-84-608-33				1	16	['Qualificação de periódicos', 'Estrato QUALIS', 'Ciência da Informação']
4727357182510680	Caracterização de pesquisadores utilizando indicadores bibliométricos de senioridade e inatividade: um estudo de caso dos Bolsistas de Produtividade 1A-CNPq	2016	10.13140/RG.2.1.2416.6008	5º Encontro Brasileiro de Bibliometria e Cientometria			1	1	1	7	['estudos bibliométricos', 'senioridade', 'inatividade academica']
4727357182510680	Acessibilidade de Dispositivos Móveis: Mapeamento de Problemas e Estudo de Gestos de Toque	2016	10.1145/3033701.3033703	XV Brazilian Symposium on Human Factors in Computer Systems (IHC 2016)							[]
4727357182510680	Caracterização das redes de convites de bancas de defesa de teses e dissertações do Brasil	2016		XVII Encontro Nacional de Pesquisa em Pós-Graduação em Ciência da Informação							[]
4727357182510680	Genealogia acadêmica dos doutores atuantes em matemática: um mapeamento macro na ciência brasileira	2017	10.5540/03.2018.006.01.0370	Congresso Nacional de Matemática Aplicada e Computacional							[]
4727357182510680	Identificação do grafo de genealogia acadêmica de pesquisadores: Uma abordagem baseada na Plataforma Lattes	2017		BRAZILIAN SYMPOSIUM ON DATABASES (SBBD 2017)							[]
4727357182510680	Identificação da Rede Nacional de Pesquisadores na área de Prevenção de Drogas em Contextos Educacionais	2017		Congresso Internacional Abramd							[]
4727357182510680	Criação de grafos de tópicos do conhecimento baseada em genealogia acadêmica	2018		6º Encontro Brasileiro de Bibliometria e Cientometria (EBBC)					1	8	[]
4727357182510680	Formação, endogenia e influência institucional na academia brasileira: Uma análise da absorção de doutores nas instituições de ensino superior	2018		6º Encontro Brasileiro de Bibliometria e Cientometria (EBBC)					1	7	[]
4727357182510680	Medindo o grau de multidisciplinaridade baseado em produções bibliográficas	2018		6º Encontro Brasileiro de Bibliometria e Cientometria (EBBC)					1	8	[]
4727357182510680	Genealogia acadêmica: Um novo olhar sobre impacto acadêmico de pesquisadores	2018		I Seminário de Avaliação de Políticas de CT&I					1	15	[]
4727357182510680	Identification of the Brazilian academic roots through mining advisor-advisee relationships	2018		Symposium on Knowledge Discovery, Mining and Learning (KDMiLe)					1	8	[]
4727357182510680	An empirical analysis on the relationship between publications and academic genealogy	2019		17th International Conference on Scientometrics & Informetrics							[]
4727357182510680	Identificação de Acadêmicos Promissores de Sucesso Científico através de Programação Linear Inteira	2019		Simpósio Brasileiro de Pesquisa Operacional							[]
4727357182510680	Ensino de programação avançada incentivando a metacognição: uma experiência positiva usando Moodle+VPL	2019		Simpósio Brasileiro de Informática na Educação					1	10	[]
4923576932176873	A Integracao Entre As Bolsas de Valores de Buenos Aires e Sao Paulo	1997		ENANPAD							['Integracao Entre Paises', 'Mercosul', 'Versao Internacional do Capm']
4923576932176873	Risco e Retorno das Value e Growth Stocks No Mercado Brasileiro	1997		21o. ENANPAD							['Acoes de Crescimento e de Valor', 'Coeficiente Beta', 'Mercados Eficientes']
4923576932176873	Performance do Capital Estrangeiro No Mercado de Capitais Brasileiro	1997		17o. ENEGEP E 3o. CONGRESSO INTERNACIONAL DE ENGENHARIA INDUSTRIAL							['Administracao de Portfolios', 'Indice de Sharpe', 'Market Timing']
4923576932176873	Diferencial Teorico Entre As Tecnicas de Determinacao da Liquidez: Duration e Payback	1997		17o. ENEGEP E 3o. CONGRESSO INTERNACIONAL DE ENGENHARIA INDUSTRIAL							['Custo de Capital', 'Liquidez']
4923576932176873	Custo de Capital Proprio Associado A Liquidez: Aplicacao do Modelo Proposto Nas Empresas Ceval e Sadia	1997		17o. ENEGEP, E 3o. CONGRESSO INTERNACIONAL DE ENGENHARIA INDUSTRIAL							['Custo de Capital', 'Liquidez']
4923576932176873	The Impact Of International Crosslisting On Risk And Return: An Event Study From American Depository Receipts On Stocks Of Brazilin Firms	1997		WORLD PRODUCTIVITY CONGRESS, 10							['ADR', 'Estudo de Eventos']
4923576932176873	O Efeito do Lancamento de Adrs Sobre O Retorno das Acoes de Empresas Brasileiras: Um Estudo de Evento	1996		CONGRESSO COPPEAD DE ADMINISTRACAO, 6							['ADR', 'Acoes', 'Estudo de Evento']
4923576932176873	Sera Que Beta Ainda e Valido Para Explicar As Variacoes Nas Rentabilidades Medias das Acoes?	1996		20o. ENANPAD					335	348	['CAPM', 'Coeficiente Beta', 'Mercados Eficientes']
4923576932176873	Avaliacao de Empresas: Um Estudo de Caso	1995		ENEGEP, 15 E CONGRESSO INTERNACIONAL DE ENGENHARIA INDUSTRIAL, 1		2			648	652	['Avaliacao de Empresas', 'CAPM', 'Custo de Capital']
4923576932176873	Avaliacao Economica de Projetos: uma abordagem do CAPM	1994		18o.ENANPAD		5			08	16	['Avaliacao de Projetos', 'CAPM', 'Taxa Interna de Retorno']
4923576932176873	Performance Ajustada Aos Diversos Níveis de Risco	1998		22o. ENANPAD		Finanç					['Administracao de Carteiras', 'Indices de Performance']
4923576932176873	Variáveis Fundamentalistas e o Retorno das Ações	1998		22. ENANPAD		Finanç					['Variaveis Fundamentalistas', 'Beta', 'CAPM']
4923576932176873	Avaliaçao de Desempenho dos Investimentos dos Fundos de Pensao Brasileiros	1998		CONGRESSO BRASILEIRO DOS FUNDOS DE PENSAO		1			145	156	['Fundos de Pensao', 'Indices de Performance']
4923576932176873	Retornos e Riscos das Value e Growth Stocks No Mercado Brasileiro	1998		1998 BUSINESS ASSOCIATION FOR LATIN AMERICAN STUDIES		1			334	345	['Acoes de Crescimento e de Valor', 'Coeficiente Beta', 'Mercado Eficiente']
4923576932176873	Uma análise de co-integração entre a Bolsa de Valores de São Paulo e as principais bolsas de valores da América do Sul	1998		XXX Congresso Brasileiro de Pesquisa Operacional		Finanç					['co-integração', 'raiz unitária']
4923576932176873	Brazilian Pension Fund Performance Analisys	1999		28th Western Decision Sciences Institute (WDSI)		1			09	12	['Administracao de Portfolios', 'Indice de Sharpe', 'Market Timing', 'Indice de Jensen', 'Indice de Treynor']
4923576932176873	A influência de eventos positivos e negativos sobre a volatilidade dos mercados da América Latina	1999		XIX ENEGEP e IV Congresso Internacional de Engenharia Industrial		1			.	.	['Volatilidade', 'GARCH', 'Sobre-Reacao']
4923576932176873	Análise de co-integração entre mercados de ações da América do Sul	1999		XXIII ENANPAD		Fin			.	.	['co-integração', 'raiz unitária', 'Integracao Entre Paises']
4923576932176873	Aplicação da metodologia Box-Jenkins na previsão do índice da Bolsa de Valores de São Paulo:um exercício em séries temporais utilizando os modelos ARIMA	1998		SPOLM-98		1					['ARIMA', 'Box-Jenkins', 'Ibovespa']
4923576932176873	Quantas ações tornam um portfolio diversificado no mercado de capitais brasileiro?	1998		VII Congresso Coppead de Administração		1					['Markowitz', 'Administracao de Portfolios', 'diversificação']
4923576932176873	The impact of cross-listings: an event study of Brazilian ADRs.	1998		1998 Meeting of the Financial Management Association International (FMA)		1					['ADR', 'Estudo de Evento', 'Mercado Eficiente']
4923576932176873	Benchmarking endógeno na avaliação de fundos de investimentos	2000		XXIV ENANPAD		Fin			131	.	['Data Envelopment Analysis', 'Administracao de Carteiras']
4923576932176873	Causalidade e cointegração das principais bolsas de valores do mundo e da América Latina	2000		XXIV ENANPAD		Fin			129	.	['co-integração']
4923576932176873	The effect of the benchmark portfolio on the performance evaluation of pension funds in Brazil.	2001		30th Annual Meeting of the WDSI (Western Decision Science Institute)		1				.	['Fundos de Pensao', 'Índices de desempenho', 'Ibovespa']
4923576932176873	Stock return behavior in domestic and ADR markets: evidence from Brazilian and Argentine stock markets.	2001		30th Annual Meeting WDSI (Western Decision Sciences Institute)		1			.	.	['ADR', 'Correlações entre índices de ações']
4923576932176873	Planejamento de sistemas de recalque	1986		XIX SOBRAPO		19	1		95	108	['Teoria do Grafos', 'Programação Dinâmica', 'Sistemas de recalque']
4923576932176873	A sobre-reação dos investidores no mercado de capitais brasileiro	1992		XXIV SOBRAPO		24					['Sobre-reação']
4923576932176873	Comparando métodos de avaliação: TIR, VPL e CAPM	1992		XII ENEGEP		1			516	524	['CAPM', 'Taxa Interna de Retorno', 'Valor presente líquido']
4923576932176873	O efeito fim-de-semana durante períodos de abertura e de fechamento das bolsas de valores.	1993		XVII ENANPAD		6			103	110	['Efeito Fim de Semana', 'Anomalias', 'Bolsa de Valores']
4923576932176873	Teoria do caos e a eficiência do mercado de capitais	1993		XIII ENEGEP		2					['Teoria do Caos', 'Eficiência de mercado']
4923576932176873	Engenharia financeira: swaps de taxas de juros	1993		XIII ENEGEP		2			1099	1113	['Engenharia financeira', 'Swaps']
4923576932176873	Testando a validade da paridade do poder de compra na economia brasileira	2001		XXV ENANPAD		1				.	['Paridade do poder de compra']
4923576932176873	Segmentação de mercado, comportamento do mercado doméstico e de ADRs: algumas evidências do mercado brasileiro e argentino.	2001		XXV ENANPAD		1				.	['ADR', 'Correlações entre índices de ações']
4923576932176873	Testing Differences of Stock Returns Before and After the Opening of Emerging Economies	2002		IBEC 2002 - International Business and Economy Conference	15372316						['Integração de mercados', 'Análise multivariada']
4923576932176873	Multiple regression analysis applied to the profitability of the pension fund investments in Brazil: a primer.	2002		31st Annual Meeting of the Western Decision Sciences Institute (WDSI)							['Regressão múltipla', 'Fundos de Pensao']
4923576932176873	Ratio versus regression analysis: some empirical evidence in Brazil	2002		Segundo Encontro Brasileiro de Finanças		CD-Rom					['índices financeiros', 'análise de regressão']
4923576932176873	Cointegração e causalidade entre variáveis macroeconômicas, risco Brasil e os retornos no mercado de ações brasileiro	2002		ANPEC SUL 2002							['Variáveis macroeconômicas', 'Índices de mercado', 'co-integração']
4923576932176873	Estimação da Co-Integração das Principais Bolsas da América Latina, Estados Unidos e Japão pela Metodologia de Johansen.	2002		XXVI ENANPAD							['co-integração', 'Bolsa de Valores', 'Metodologia de Johansen']
4923576932176873	A relação entre os lucros das empresas e os preços de suas ações no mercado de capitais: uma aplicação do teste de causalidade de Granger	2003		Terceiro Encontro Brasileiro de Finanças							['Lucro', 'Causalidade de Granger', 'Hipótese de mercado eficiente']
4923576932176873	Estimativa do custo de capital próprio de pequenas empresas através do CAPM	2003		III EGEPE							['Custo de Capital Próprio', 'CAPM']
4923576932176873	Benefícios econômicos e estratégicos da implementação de sistemas de gestão ambiental: reflexões e alguns exemplos de sucesso.	2004		Slade 2004		CD-Rom					['Gestão ambiental', 'ISO 14000', 'Estudo de Evento', 'Índices de lucratividade']
4923576932176873	A reciclagem de resíduo de construção e demolição: uma aplicação da análise multivariada.	2004		I Conferência Latino-americana de Construção Sustentável (CLACS´04) e 10o. Encontro Nacional de Tecnologia do Ambiente Construído (ENTAC´04).		CD-Rom					['Resíduos de construção e demolição', 'Reciclagem', 'Análise multivariada']
4923576932176873	A relação entre o mercado de ações e variáveis macroeconômicas: uma análise econométrica para o Brasil no período pós-plano Real.	2004		VII Encontro de Economia da Região Sul		CD-Rom					['Variáveis macroeconômicas', 'Índices de ações', 'Causalidade reversa']
4923576932176873	Co-movimentos entre os mercados de ações da América Latina e Ásia	2004		Quarto Encontro Brasileiro de Finanças		CDROM					['Co-movimentos', 'Correlação', 'Teste M de Box', 'Análise de componentes principais']
4923576932176873	Meio ambiente e desempenho econômico-financeiro: benefícios dos Sistemas de Gestão Ambiental (SGAs) e o impacto da ISO 14001 nas empresas brasileiras.	2004		XXVIII Enanpad				GSA2596			['Sistemas de Gestão Ambiental', 'NBR ISO 14001', 'Desempenho Financeiro']
4923576932176873	Crise, co-integração e previsão: uma aplicação nos mercados acionários da América Latina, Estados Unidos, Japão e Inglaterra.	2004		XXVIII Enanpad		FIN918					['Crises econômicas', 'Efeito contágio', 'Previsão com co-integração']
4923576932176873	Uma aplicação da teoria das opções reais à análise de investimentos em tecnologia ASP.	2004		XXXVI Simpósio Brasileiro de Pesquisa Operacional		CDROM		TC035			['Opções reais', 'Tecnologia ASP - Application Service Provider']
4923576932176873	Desempenho ambiental versus desempenho econômico-financeiro: um estudo em empresas brasileiras certificadas pela ISO 14001	2004		18o. Congresso do Mercado de Capitais - APIMEC		CDROM					['Sistemas de Gestão Ambiental', 'NBR ISO 14001', 'Desempenho Financeiro']
4923576932176873	Linear and nonlinear univariate models applied to forecasting financial series	2005		The Institute of Industrial Engineers Annual Conference, IERC 2005 Conference		1			1	6	['Forecasting', 'Nonlinear models', 'Linear models']
4923576932176873	Relationship between environmental and economic-financial performances: the study from EMS certification.	2004		20th EGOS Colloquium (European Group for Organizational Studies)							['Meio Ambiente', 'ISO 14000', 'Estudo de Evento']
4923576932176873	Cash Flow, Earnings, and Dividends: a Comparison Between Different Valuation Methods for Brazilian Companies	2006		Sexto Encontro Brasileiro de Finanças		CDROM					['Avaliação de empresas', 'Desconto de dividendos', 'Fluxo de caixa descontado', 'Lucro residual']
4923576932176873	Cash Flow, Earnings, and Dividends: a Comparison Between Different Valuation Methods for Brazilian Companies.	2006		XXX ENANPAD		FIC-D	1684				['Avaliação de empresas', 'Fluxo de caixa descontado', 'Lucro residual', 'Desconto de dividendos']
4923576932176873	O índice Ibovespa e a lógica fuzzy: uma nova estratégia de investimento.	2006		Congresso Virtual Brasileiro de Administração - CONVIBRA	2179-5967	CDROM					['Lógica fuzzy', 'Eficiência de mercado', 'Estratégias de investimentos']
4923576932176873	Forecasting Brazilian exchange rates with nonlinear models.	2005		VII Congresso Brasileiro de Redes Neurais	18088589						[]
4923576932176873	Alavancagem, liquidez, tamanho, risco, imobilizado e intangíveis: um estudo de algumas condicionantes do book-to-market em empresas brasileiras.	2006		XLI Asamblea Anual CLADEA 2006		1					[]
4923576932176873	Fluxo de caixa, lucro contábil e dividendos: comparação de diferentes enfoques na avaliação de empresas brasileiras.	2006		XLI Asamblea Anual CLADEA 2006		7					[]
4923576932176873	Propriedades das séries temporais de lucros trimestrais de empresas brasileiras.	2007		EnANPAD							['Lucro trimestral', 'Random walk']
4923576932176873	Previsão fuzzy do S&P 500 com regras não-estacionárias	2007		EnADI							['Lógica fuzzy', 'Previsão de índices de mercado']
4923576932176873	Finance Journals: Características dos Principais Periódicos, Autores Importantes e Artigos Mais Citados	2007		I Encontro de Ensino e Pesquisa em Administração e Contabilidade (EnEPQ)							['Finanças', 'Finance Journals']
4923576932176873	Estimação da Co-Integração das Principais Bolsas da América Latina, Estados Unidos e Japão pela Metodologia de Johansen	2002		XXVI Encontro da ANPAD							['co-integração', 'Metodologia de Johansen']
4923576932176873	Efeito disposição e experiência: um teste de laboratório no Brasil	2008		XXXII EnANPAD		1					['Efeito disposição', 'Teoria do prospecto', 'Experiência no mercado de ações']
4923576932176873	O efeito dia-de-vencimento de opções na BOVESPA revisitado	2008		ANPEC2008							['Efeito dia-de-vencimento', 'Opções', 'Hipótese de mercado eficiente']
4923576932176873	Explaining earnings persistence: a threshold autoregressive panel unit root approach	2009		9 Encontro Brasileiro de Finanças		CD-Rom					['Earnings persistence', 'Accruals', 'Threshold autoregressions', 'Panel unit root tests']
4923576932176873	Explicando a persistência do lucro anormal das empresas brasileiras: um enfoque baseado na assimetria do efeito do lucro anormal defasado	2009		9 Encontro Brasileiro de Finanças		CD-Rom					['Lucro anormal', 'Persistência de lucros', 'Modelos autorregressivos']
4923576932176873	EMS certification and economic-financial performance: a study on Brazilian companies.	2009		BAM Conference 2009		1			1	15	['EMS']
4923576932176873	Impacto do Ni&#769;vel de Disclosure Corporativo na Volatilidade das Ac&#807;o&#771;es de Companhias Abertas no Brasil	2010		X Congresso USP de Controladoria e Contabilidade							['Disclosure', 'Volatilidade', 'Tranparência', 'Risco']
4923576932176873	O comportamento dos componentes da volatilidade das ações no Brasil no período de 1996 a 2010	2011		14a. Escola Escola de Séries Temporais e Econometria (ESTE)							['Volatilidade']
4923576932176873	O comportamento manada em mercados acionarios latino-americanos	2011		XI Encontro Brasileiro de Finanças		1					['Efeito manada']
4923576932176873	Anomalia dos accruals no mercado brasileiro de capitais	2011		XXXV EnANPAD		Fin					['Accruals']
4923576932176873	Uma investigação sobre a racionalidade nas negociações no mercado acionário brasileiro	2011		XXXV EnANPAD		Con					['Finanças comportamentais', 'Turnover anormal', 'Efeito disposição']
4923576932176873	Hedging against embarrassment	2012		Society for Consumer Psychology Florence Conference		1					['Embarrassment', 'Disposition effect']
4923576932176873	The disposition effect and group decision making	2012		Fourth Annual Meeting of the Academy of Behavioral Finance & Economics		1					['Disposition effect', 'Group decision making']
4923576932176873	The disposition effect and group decision making	2013		2013 FMA European Conference		1					['Efeito disposição', 'Group decision making']
4923576932176873	Excesso de confiança: uma análise entre turnover e retorno no mercado brasileiro	2013		13o. Encontro Brasileiro de Finanças		1					['Excesso de confiança', 'Turnover']
4923576932176873	Aversão ao risco, efeito disposição e a tomada de decisão em grupo	2013		13o. Encontro Brasileiro de Finanças		1					['Efeito disposição', 'Group decision making']
4923576932176873	Hedging against embarassment	2013		XXXVII ENANPAD	2177-2576	1					['Disposition effect', 'Behavioral finance', 'Lab experiments', 'Self-conscious emotions']
