ID-Lattes	Título	Ano	DOI	Veículo	ISBN	Volume	Fascículo	Serie	P-inicial	P-final	Palavras-chave	
6879546236123358	Do Latin American banks behave as Too Big to Fail? The effects of size and market concentration on efficiency and risk-taking	2011		33 Econtro Brasileiro de Econometria		1	1	1	1		[]
6879546236123358	Bank efficiency and non-performing loans in Brazil: causality tests	2011		33 Encontro Brasileiro de Econometria		1	1	1	1		[]
6879546236123358	Revealed (P)Reference Theory with Aspirations	2012		34º Meeting of the Brazilian Econometric Society		1	1	1	1	12	[]
6879546236123358	Combined optimization of portfolio and risk exposure of an insurance company	2002		International Symposium on Mathematical Theory of Networks and Systems (MTNS 2002)					1	11	['FINANÇAS', 'CONTROLE OTIMO ESTOCÁSTICO']
8761482881522916	Desenvolvimento da Dimensão Comunitária da Responsabilidade Social das Organizações: um estudo de caso sobre a Light e suas contribuições para o desenvolvimento humano sustentável, a inclusão social e a cidadania	2002		XXVI ENANPAD							['Responsabilidade Social Corporativa', 'Teoria das Organizações', 'Light']
8761482881522916	Estratégias De Diversificação A Partir Do Sistema De Franquia ? Revisitando a Teoria doCrescimento da Firma	2005		ENANPAD 2005							['Estratégia']
8761482881522916	Responsabilidade Social e Estratégia: Em Busca de um Diálogo Latino-Europeu	2005		International Conference of the Iberoamerican Academy of Management							['Responsabilidade Social Corporativa', 'Estratégia']
8761482881522916	Corporate Social Responsibility and Strategic Management: a Historical Analysis	2006		22nd EGOS Colloquium							['Responsabilidade Social Corporativa', 'Estratégia', 'Historiografia']
8761482881522916	Should Corporate Social Responsibility be taken as ?Strategic??: a Critical Approach	2006		IV Encontro de Estudos Organizacionais da ANPAD							['Estratégia', 'Historiografia', 'Responsabilidade Social Corporativa']
8761482881522916	A Utilização do Método Histórico em Pesquisa Acadêmica de Marketing	2006		Encontro de Marketing da ANPAD							['Historiografia', 'Marketing', 'Estratégia']
8761482881522916	Em defesa de uma abordagem menos estratégica para a Responsabilidade Social	2005		II Encontro de Estudos em Estratégia da ANPAD							[]
8761482881522916	Stakeholder Strategizing: Uma Proposta de Investigação da Estruturação das Práticas de Relacionamento Comunitário	2007		ENANPAD		1	1		1	16	[]
8761482881522916	Responsabilidade Social Corporativa em Marketing: Em Defesa de uma Abordagem Plural	2008		Encontro de Marketing da ANPAD		1	1				[]
8761482881522916	Estratégias de Responsabilidade Social e Esfera Pública: um Debate sobre as Dimensões Sociopolíticas das Ações Empresariais para Stakeholders	2008		ENAPG							['Estratégia', 'Responsabilidade Social', 'Teoria dos Stakeholders']
8761482881522916	Uma Análise das Estratégias de Responsabilidade Social Empresarial dos Fundos de Investimento Éticos	2009		Encontro de Estratégia da ANPAD - 3Es							['Estratégia', 'Responsabilidade Social', 'Fundos Éticos']
8761482881522916	De-colonizing corporate social responsibility: a pluralist and structurationist proposal in Brazil	2009		Critical Management Studies							['Responsabilidade Social Corporativa']
8761482881522916	É Possível Escapar do Colonialismo em Responsabilidade Social Empresarial no Brasil? Uma Proposta Pluralista, Praxeológica e Estruturacionista	2009		XXIIV Encontro da ANPAD							['Estratégia', 'Responsabilidade Social']
8761482881522916	Construção do Curso de Extensão ?Desenvolvimento de Competências Gerenciais? no Âmbito do Programa Diálogo	2009		E-Learning							['Educação a Distância', 'Educação Corporativa', 'Estudos Organizacionais', 'Metodologia do Ensino']
8761482881522916	CSR, PUBLIC GOODS AND THE AGENCY OF BIG CORPORATIONS IN BRAZIL	2010		LAEMOS		1			1	19	['Estratégia', 'Responsabilidade Social Corporativa', 'Economia Política']
8761482881522916	Revisitando Agência em Estratégia via Estudos Organizacionais	2010		Encontro Nacional de Estudos Organizacionais		1	1		1	17	['Agência', 'Estratégia', 'Estudos Organizacionais']
8761482881522916	Responsabilidade Social Empresarial e Bens Públicos: Investigando Agência e Não-Ação no Brasil	2010		ENANPAD		1	1				['Responsabilidade Social', 'Estratégia', 'Agência', 'Não-ação']
8761482881522916	Agência em Estratégia: Pluralismo, Estruturação e Co-determinação	2010		Congresso Nacional de Administração e Ciências Contábeis							['Agência', 'Estratégia', 'Estudos Organizacionais']
8761482881522916	A Liderança Feminina nos Hemocentros e a sua relação com a Melhoria da Qualidade	2010		Encontro Administração Pública e Governança da ANPAD							['Adminitração Pública', 'Avaliação de Projetos']
8761482881522916	Transformação de Práticas Institucionalizadas: uma análise das limitações do marketing social	2011		Encontro Nacional de Estudantes de Administração Pública		1	1		1	100	[]
8761482881522916	O Gestor Público e a Teoria do Medalhão: um Caso de Ensino sobre a Formação de Competências a partir de um Conto de Machado de Assis.	2011		Encontro Nacional de Ensino e Pesquisa em Administração							[]
8761482881522916	Estratégia de Responsabilidade Social no âmbito de Bens Públicos no Brasil	2011		Congresso Nacional de Administração e Ciências Contábeis							[]
8761482881522916	Metodologia no Estudo da Agência: uma pesquisa em estratégia como prática no Brasil	2012		ENANPAD 2012		1					['Administração', 'Estratégia como Prática Social', 'Estratégia', 'Metolodogia de Pesquisa']
8761482881522916	BSC no Poder Judiciário: uma Proposta de Estudo da Estratégia como Prática Social	2012		ENANPAD 2012		1	1	1			[]
8761482881522916	Um Estudo sobre a Divulgação de Informações de Gestão Ambiental nas Homepages das Prefeituras dos Grandes Municípios Brasileiros	2012		ENANPAD 2012		1	1	1			['Adminitração Pública', 'Contabilidade e Orçamento Públicos']
8761482881522916	Pluralismo no Estudo da Agência em Contabilidade: Contribuições da Perspectiva da Prática Social	2012		Congresso Nacional de Administração e Contabilidade		1					[]
8761482881522916	O SUS como ele realmente é: estudo de caso sobre a parceria público-privada	2012		Encontro Nacional dos Estudantes de Administração Pública		1		1			['Adminitração Pública', 'SUS']
8761482881522916	A Cultura Organizacional e o Custeio Variável: Um estudo em uma Organização Militar Prestadora de Serviço	2012		XIX Congresso Brasileiro de Custos		1	1	1	1	16	[]
8761482881522916	O Impacto da Avaliação de Ativos Imobilizados no Setor Público: um estudo de caso	2012		ENAPG		1	1	1	1	16	[]
8761482881522916	Determinantes do Nível de Endividamento dos Municípios do Estado do Espírito Santo	2013		Congresso ANPCONT		1	1	1			['Contabilidade e Orçamento Públicos', 'Municípios', 'Endividamento']
8761482881522916	Participação Social na Gestão das Instituições Federais de Ensino Superior - O Caso da Universidade Federal de Viçosa	2013		Congresso Nacional de Excelência em Gestão - CNEG		1	1		1	16	[]
8761482881522916	AVALIAÇÃO DE DESEMPENHO EM SAÚDE: UM ESTUDO COMPARATIVO ENTRE O ÍNDICE DE DESEMPENHO DO SISTEMA ÚNICO DE SAÚDE (IDSUS) E O ÍNDICE DE DESEMPENHO DA SAÚDE SUPLEMENTAR (IDSS)	2013		SIMPOI 2013		1	1		1	16	[]
8761482881522916	GERENCIAMENTO DA INFORMAÇÃO CONTÁBIL NOS MUNICÍPIOS BRASILEIROS: A LEI DE RESPONSABILIDADE FISCAL (LRF) E O LIMITE DE DESPESAS CONSOLIDADAS DE PESSOAL	2013		XIII Congresso USP de Controladoria e Contabilidade		1	1		1	16	[]
8761482881522916	A Reforma do Poder Judicia&#769;rio Segundo os Servidores de um Tribunal de Justic&#807;a: Um Estudo Baseado na Perspectiva das Representac&#807;o&#771;es Sociais	2013		ENANPAD		1	1	1	1	16	[]
8761482881522916	Relevância dos Gastos Públicos na Determinação do Desenvolvimento Municipal no Estado do Espírito Santo	2013		ENANPAD		1	1	1	1	16	[]
8761482881522916	A nova contabilidade pública é realmente nova? Um breve panorama histórico no Brasil	2013		IV Congresso Nacional de Administração e Ciências Contábeis - AdCont		1	1		1	16	['Contabilidade e Orçamento Públicos', 'Convergência ao Padrão Contábil Internacional']
8761482881522916	Ética dos Consumidores Brasileiros: uma investigação sobre os fatores que influenciam as atitudes dos consumidores finais	2013		IV Congresso Nacional de Administração e Ciências Contábeis - AdCont		1	1	1	1		['Administração', 'Comportamento do Consumidor', 'Ética']
8761482881522916	Uma proposta de estudo da estratégia como prática social na administração pública: o caso do poder judiciário	2013		IV Congresso Nacional de Administração e Ciências Contábeis - AdCont		1	1	1	1		['Adminitração Pública', 'Estratégia como Prática Social', 'Poder Judiciário']
8761482881522916	Desafios à Implantação da Lógica Dominante de Serviços Públicos no Brasil: Considerações a partir das Percepção de Servidores	2014		ENANPAD		1	1	1	1	17	[]
8761482881522916	Revisitando Abordagens em Governança Pública em Busca de uma Proposta para o Estudo da Dimensão Público-Privada no SUS	2014		ENANPAD		1	1	1	1	17	[]
8761482881522916	Braços e Mentes ao SUS: Relato Crítico e Multidisciplinar de Imersão Acadêmica no Ver-SUS-RJ - CAP 5.2 do Município do Rio de Janeiro	2014		Congresso Brasileiro de Gestão do Conhecimento							['Adminitração Pública', 'Saúde Pública', 'SUS']
8761482881522916	Governança no Setor Público: Diagnóstico de Práticas de Gestão de OSs no Rio de Janeiro à Luz do Estudo 13 do PSC/IFAC	2014		V Congresso Nacional de Administração e Ciências Contábeis - AdCont 2014							['Contabilidade e Orçamento Públicos', 'Gestão Pública', 'Governança', 'Saúde Pública']
8761482881522916	O Potencial de Accountability dos Tribunais de Contas e Governança Pública: um estudo sobre os Gastos com Saúde dos Estados Brasileiros	2014		V Congresso Nacional de Administração e Ciências Contábeis - AdCont 2014							['Contabilidade e Orçamento Públicos', 'Governança', 'Accountability', 'Tribunal de Contas']
8761482881522916	PRÁTICAS SOCIAIS DE ORÇAMENTAÇÃO E FATURAMENTO EM ORGANIZAÇÕES E PROJETOS DE INOVAÇÃO NA ADMINISTRAÇÃO PÚBLICA: UM ESTUDO DE CASO EM UMA ORGANIZAÇÃO MILITAR PRESTADORA DE SERVIÇOS (OMPS)	2015		Congresso ANPCONT		1	1		1	16	[]
8761482881522916	ACCOUNTABILITY E CONTROLE DE AGÊNCIAS REGULADORAS: UMA ANÁLISE DA PARTICIPAÇÃO DOS ATORES SOCIAIS EM CONSULTAS PÚBLICAS DA ANATEL	2015		Congresso ANPCONT		1	1		1	16	[]
8761482881522916	Códigos de Ética na Administração Pública em Perspectiva Comparada: um Estudo Brasil, Estados Unidos, Reino Unido, Nova Zelândia e Coréia do Sul.	2015		ENANPAD		1	1		1	16	[]
8761482881522916	Epistemologias Alternativas em Contabilidade: uma Reflexão Teórica sobre as Contribuições de Abordagens Não-Mainstream para a Contabilidade Gerencial	2015		ENANPAD		1	1		1	16	[]
8761482881522916	Análise da Eficiência dos Municípios Brasileiros na Gestão dos Recursos da Atenção Básica em Saúde nos Anos de 2010 e 2011	2015		XV Congresso USP de Controladoria e Contabilidade		1	1		1	17	[]
8761482881522916	Conselhos do FUNDEB: Controle Social da Educação Pública	2015		VI AdCont - Congresso Nacional de Administração e Contabilidade		1	1	1	1	17	[]
8761482881522916	Governança no Setor Público: Diagnóstico de Práticas de Gestão de Organizações Sociais de Saúde no Rio de Janeiro	2016		Congresso Brasileiro de Contabilidade		1	1	1	1	17	[]
8761482881522916	Gerenciamento de Impressões e Accountability como Gestão da Reputação: uma Análise das Ações do CARF	2016		Congresso Brasileiro de Contabildiade							[]
8761482881522916	Transparência Ativa: Uma Análise Horizontal da LAI nos Maiores Municípios Arrecadadores Brasileiros	2016		Congresso Brasileiro de Contabilidade							[]
8761482881522916	Evolução Recente na Reforma do Judiciário e Representações Sociais nas Perspectivas de Magistrados do Tribunal de Justiça do Estado da Bahia	2016		ENANPAD							[]
8761482881522916	Análise da Influência de Fatores Sociais, Políticos, Econômicos e Culturais na Adoção das IPSAS por Diferentes Países	2016		ENANPAD							[]
8761482881522916	Perspectivas Pós-Coloniais e Decoloniais: uma proposta de agenda de pesquisa em Contabilidade no Brasil	2016		ENANPAD							[]
8761482881522916	Eficiência do Gasto Público com Ensino Fundamental: Uma Análise dos 250 Maiores Municípios Brasileiros	2016		Congresso USP de Controladoria e Contabilidade							[]
8761482881522916	Accountability via Consultas Pública de Agências Reguladoras: Controle Social e Participação de Atores Junto à Anatel	2016		Congresso USP de Controladoria e Contabilidade							[]
8761482881522916	Administração Pública no Brasil, Gerencialismo e Atuação das Consultorias	2016		Congresso AdCont		I			1	17	[]
8761482881522916	Management Control in Public Administration: a critical and interpretive proposal to study the reform of the Brazilian Judiciary	2017		10th International Critical Management Studies Conference ? CMS2017		1	1				[]
8761482881522916	Postcolonial and Decolonial Perspectives: a proposal for a research agenda in Accounting in Brazil	2017		10th International Critical Management Studies Conference ? CMS2017		1	1	1			[]
8761482881522916	PERCEPÇÕES SOBRE SISTEMAS DE CUSTO APLICADO AO SETOR PÚBLICO  UMA ANÁLISE NA UNIVERSIDADE FEDERAL DO ESPÍRITO SANTO	2017		AdCont 2017		1	1		1	17	[]
8761482881522916	Qualidade da Informação e os Processos Administrativos Sancionadores Julgados pela CVM entre 2014 a 2016	2017		AdCont 2017		1	1		1	16	[]
8761482881522916	PROGRAMA MAIS MÉDICOS: UMA ANÁLISE ESTRUTURADA DOS RELATÓRIOS DE AUDITORIA DA CONTROLADORIA GERAL DA UNIÃO	2018		IV COngresso UnB de Contabilidade e Governança		1	1	1	1	17	[]
8761482881522916	AMBIENTE INSTITUCIONAL DE CONTABILIDADE, VOZ E ACCOUNTABILITY, DISTÂNCIA DO PODER E CORRUPÇÃO: UMA ANÁLISE CROSS COUNTRY	2018		XII Congresso ANPCONT		1	1	1	1	17	[]
8761482881522916	Trajetória, Desafios e Tendências na Articulação Pedagógica entre Graduação e Pós-graduação de Administração e Administração Pública no Brasil.	2007		Encontro Nacional de Ensino e Pesquisa em Administração		1	1		1	16	[]
9311310817226781	Cultura Politica Predatoria e Hobbesianismo Social: O Caso do Distrito Federal	1997		SBPC							[]
9311310817226781	Informational Shortcuts in Complex Electoral Environments:	2006		Encontro do Anpocs							[]
9311310817226781	Contextos Eleitorais Complexos, institutições e informação política: us estudo comparada de sistemas eleitorais na América Latina	2009		II Congresso Latinoamericano de Opinión Pública		1					[]
9311310817226781	3a Mesa-Redonda: Fortalecimento da Democracia Direta e da Democracia Participativa - Plebiscito, Iniciativa Popular, Recall, Regulação	2007		Seminário Reforma Política	320981				84	88	[]
9311310817226781	Deputados Federais, Redes Sociais e Políticas Distributivistas: uma explicação pelo lado da demanda	2009		33 Encontro Anual da Anpocs							[]
9311310817226781	Bonds, Stocks or Dollars? Do Voters Care about Capital Markets in Brazil and Mexico	2009		2009 Annual Meeting of the American Political Science Association							[]
9311310817226781	Democratic Crisis in America: Citizens Experiences with Corruption, Political Protest and the Economy	2009		General Conference of the European Consortium for Political Research							[]
9311310817226781	Prognóstico Eleitoral em Novas Democracias: Quem será eleito Presidente do Brasil em 2010?	2010		7º Encontro da Associação Brasileira de Ciência Política							[]
9311310817226781	Pork para quem precisa: o impacto de emendas orçamentárias nos municípios Brasileiros	2010		7º Encontro da Associação Brasileira de Ciência Política							[]
9311310817226781	Partisan Identification, Interpersonal Communication, and Group Identity: Evidence from a New Democracy	2010		American Political Science Association Annual Meeting							[]
9311310817226781	A Estrutura Organizacional da Presidência da República no Brasil: 1990-2010	2010		V Congresso Latino Americano de Ciência Política							[]
9311310817226781	O voto em Dilma nas eleições presidenciais de 2010: determinantes políticos, econômicos e sociais	2011		35 Encontro Anual da Anpocs							[]
9311310817226781	Scandals, Evangelicals and Vote Intentions: Volatility in the 2010 Brazilian Presidential Elections	2011		2011 American Political Science Association Annual Meeting and Exhibition							[]
9311310817226781	Divided Government and Lawmaking in the Brazilian Congress	2011		2011 American Political Science Association Annual Meeting and Exhibition							[]
9311310817226781	PT NO PURGATÓRIO: RELIGIÃO, ABORTO E CORRUPÇÃO NAS ELEIÇÕES PRESIDENCIAIS DE 2010	2012		36º Encontro Anual da ANPOCS							[]
9311310817226781	The Aftermath of Democratic Crises in Latin America	2012		LASA2012							[]
9311310817226781	The Role of the Cabinet in Legislative Production in Brazil	2012		22nd IPSA World Congress in Madrid 2012							[]
9311310817226781	Chosing candidates and evaluating governments cross-pressured by competing political values	2013		Séptimo Congresso Latinoamericano de Ciencia Politica							[]
9311310817226781	Pork Barrel Politics and Inequality: Budgetary Amendments at the Municipal Level in Brazil	2012		8o Encontro da Associação Brasileira de Ciência Política							[]
9391282233857282	O espaço na/da sociedade da informação. reflexões teórico-metodológicas a respeito do seu novo caráter enquanto "ciberespaço"	2001		IX Encontro Nacional da ANPUR		3			1756	1768	['Associativismo', 'Capital', 'Cidade', 'Cmc (Computer Mediated Communication)', 'Coleta e Reciclagem']
9391282233857282	New technologies and space - spatiality as a key concern of understanding social transformations in the information age	2001		5th Conference of the European Sociological Association, 18/8 - 1/9/01		1			184	184	['Coleta Seletiva', 'Associativismo', 'Cmc (Computer Mediated Communication)', 'Conflitos Ambientais', 'Consumo']
9391282233857282	Planejamento ambiental: Investigações sobre entraves atuais e potencialidades futuras	1994		I. Encontro Brasileiro de Ciencias Ambientais		1			3	19	['Planejamento Ambiental']
9391282233857282	Abraao´S Village Inhabitants Conditions Of Life	1994		I. Simposium Interntional for Multimidia for Arquitecture and Urban design					19	29	['Condicoes de Vida', 'Meio Ambiente']
9391282233857282	American Way e Redes Brasileiras: Novas Formas de Consumo e Sua Expressao Nas Novas Redes Territoriais	1995		VI Encontro Nacional da ANPUR					1053	1064	['Consumo', 'Marketing de Rede', 'Rede']
9391282233857282	A Rede Como Integracao da Diversidade. O Desafio da Analise de Multiplas Articulacoes de Processos Locais	1996		VI Coloquio sobre Poder Local		1	1		145	163	['Global', 'Local', 'Rede', 'Analise Territorial']
9391282233857282	Comunicação e território: Reorganização do espaço urbano e novas tecnologias de comunicação mediadas por computador (CMC)	1997		VII Encontro Nacional da ANPUR		3			2177	2189	['Cidade', 'Cmc (Computer Mediated Communication)', 'Comunicacao', 'Tecnologias de Informacao e Comunicacao']
9391282233857282	Redes, telemática e a reorganização do espaço urbano. Da -rede de cidades- à -cidade-rede-	1998		Seminário de Investigación Urbana: El nuevo milenio y lo urbano		1	1		18	19	['Tecnologias de Comunicação', 'Cidade', 'Rede']
9391282233857282	Networks, communication technologies, and the reorganization of urban space. Challenges for analyzing the case of Rio de Janeiro - Brazil	1999		Internet Society Summit 1999							['Tecnologias de Informacao e Comunicacao', 'Cidade', 'Contradições Sociais']
9391282233857282	Urbanismo abstrato na era digital? Tentativa de uma provocação	1998		V. Seminário da História da Cidade e do Urbanismo		1	1		67	78	['Redes de computadores', 'Urbanismo', 'ciberespaço', 'Tecnologias de Informacao e Comunicacao']
9391282233857282	Difusão de tecnologias de informação e comunicação (TICs) e transformações da interação social.	1999		XXII Congresso de la Associación Latinoamericana de Sociologia		1			89	97	['Tecnologias de Informacao e Comunicacao', 'Integracao Social', 'Cidades']
9391282233857282	Digital divide: Reflexões sobre novas formas de exclusão social	1999		XXIII Encontro Nacional da ANPOCS		1			2	15	['Integracao e Exclusao Social', 'Tecnologias de Informacao e Comunicacao', 'Pobreza Urbana', 'Planejamento Urbano']
9391282233857282	O planejamento comunicativo é possível? Indagações	1995		XIX Encontro Anual da ANPOCS		1	1		26	31	['Planejamento Urbano', 'Gestao Urbana', 'Projeto Politico', 'Comunicacao', 'Comunidade']
9391282233857282	´(De)Construíndo o espaço cibernético - Uma reflexão acerca da espacialidade virtua da rede mundial de computadores	2000		IV Congresso Ibero- Americano de Gráfica Digital - SiGraDI		1	1		24	37	['ciberespaço', 'Cidade']
9391282233857282	Introdução (à Sessão Especial TeleCidades)	2000		IV Congresso Ibero-Americano de Gráfica Digital		1	1	1	189	191	['ciberespaço', 'Cidade', 'Tecnologias de Informacao e Comunicacao', 'Redes de computadores']
9391282233857282	Petrópolis-Utópolis: velha urbanização ou nova urbanidade?	2003		IX Semana de Planejamento Urbano e Regional		1	1	1	127	140	['sociedade urbana', 'Urbanizacao', 'Tecnologias de Informação e Comunicação', 'Petrópolis']
9391282233857282	Potencial tecnológico e transformação local-regional: novas formas de urbanização a partir de uma mobilidade ¨virtual¨? Um caso na área peri-metropolitana do Rio de Janeiro	2004		V Coloquio sobre Transformaciones Territoriales - Nuevas visiones en el inicio del siglo XXI		1	1		89	102	['Urbanizacao', 'Planejamento', 'Mobilidade', 'Espaço Virtual', 'Organização Territorial', 'Metrópolis']
9391282233857282	O meio ambiente como forma específica de organização territorial: Elementos para uma discussão conceitual	1991		IV Encontro Nacional da ANPUR		1	1	1	637	649	['Meio Ambiente', 'Territorialidades', 'Organização Territorial', 'Metodologia']
9391282233857282	Solidariedade e gestão territorial: Indagações sobre a atuação das ONGs no Brasil	1991		IV Encontro Nacional da ANPUR		1	1	1	77	88	['Organizacoes Nao Governamentais', 'Solidariedade', 'Rede', 'Espacialidade']
9391282233857282	Redes estratégicas e de solidariedade e organização territorial à procura de novas formas territoriais	1993		V Encontro Nacional da ANPUR: Encruzilhadas das modernidades e planejamento		2	1	1	783	794	['Rede', 'Solidariedade', 'Desenvolvimento Economico', 'Organização Territorial', 'Organizacoes Nao Governamentais']
9391282233857282	Urbanismo abstrato na era digital? Tentativa de uma provocação	1998		V Seminário de História da Cidade e do Urbanismo							['Urbanismo', 'Espaço Virtual', 'Cidades']
9391282233857282	O fim das cidades e a renascença do planejamento: Desafios na ´era da informação´	2004		3. Seminário Nacional de Infra-Estrutura, Organização Territorial e Desenvolvimento Local							['Planejamento Urbano e Regional', 'Sociedade em rede', 'Tecnologias de Informação e Comunicação']
9391282233857282	Comunicação, redes e novas espacialidades	1997		Workshop Internacional Comunicação, Espaço e Novas Formas de Trabalho					15	29	['Rede', 'Comunicacao', 'Espacialidade', 'Tecnologias de Informação e Comunicação']
9391282233857282	Utopia burguesa ou revolução urbana? - Transformações da organização territorial e novas formas urbanas em áreas peri-metropolitanas do Rio de Janeiro	2005		XI Encontro Nacional da ANPUR		1			538	554	['Urbanizacao', 'Planejamento Urbano', 'Organização Territorial', 'Rio de Janeiro']
9391282233857282	Urbanização fechada em áreas metropolitana e peri-metropoltana: comparação da segregação sócio-espacial entre condomínios fechados dentro e fora da região metropolitana do Rio de Janeiro	2006		30. Encontro Anual da ANPOCS							['Condomínios fechados', 'Metrópolis', 'Região peri-metropolitana', 'Urbanizacao']
9391282233857282	Nos Limites da Participação: a superação dos discursos e o reencontro com as práticas	2006		XII Semana de Planejamento Urbano e Regional							['Planejamento', 'Participação', 'Comunicacao', 'Condicoes de Vida']
9391282233857282	Petrópolis versus Rio de Janeiro - uma cidade média subordinada à dinâmica metropolitana?	2006		II Simpósio Internacional sobre Cidades Médias		1			12	23	['Petrópolis', 'Metrópolis', 'Cidades Médias', 'Mobilidade']
9391282233857282	Nas Fronteiras da Participação: À Procura da Superação Dialética do Planejamento Comunicativo Por uma Virada Materialista	2006		X Colóquio Internacional sobre Poder Local - Desenvolvimento e Gestão Social de Territórios -		1			1	2	['Participação', 'Planejamento', 'Fronteiras da participação', 'virada materialista']
9391282233857282	Difusas periferias metropolitanas e o surgimento de novas regionalizações. O caso da área peri-metropolitana do Rio de Janeiro	2007		VII ENCONTRO NACIONAL DA ANPEGE		1	1		56	71	['Área peri-metropolitana', 'Periferia', 'Regionalizacao', 'Rio de Janeiro']
9391282233857282	Do planejamento colaborativo ao planejamento ´subversivo´: Reflexões sobre limitações e potencialidades de Planos Diretores no Brasil	2007		IX COLÓQUIO INTERNACIONAL DE GEOCRÍTCA		1	1		86	97	['Planejamento', 'Comunicacao', 'Plano Diretores', 'Subversao']
9391282233857282	Expansão da metrópole e áreas peri-metropolitanas: continuidade ou ruptura? O contexto de uma investigação do entorno do Rio de Janeiro	2007		XII ENCONTRO NACIONAL DE PÓS-GRADUAÇÃO E PESQUISA EM PLANEJAMENTO URBANO E REGIONAL		1	1		142	158	['Periferia', 'Área peri-metropolitana', 'Expansão metropolitana', 'Ruptura', 'Rio de Janeiro']
